,number,value,params_freeze,params_gamma,params_imgSize,params_lr,params_modelname,params_nd1,params_nd2,params_nd3,params_step_size,state
0,0,2.092494010925293,4,5,224,0.006875116310288597,densenet121,9,6,7,24,COMPLETE
1,1,13.447104454040527,4,8,224,3.3327071948198673e-06,resnet34,7,9,2,27,COMPLETE
2,2,5.112588882446289,1,8,512,0.020092579670291193,resnet50,7,4,2,27,COMPLETE
3,3,2.0469858646392822,3,7,512,9.195711093584041e-06,densenet121,4,2,10,19,COMPLETE
4,4,11.973108291625977,3,6,224,1.7298960752692157e-06,resnet18,4,3,10,18,COMPLETE
5,5,2.082446813583374,-1,9,224,0.025968112020783182,densenet121,10,7,9,30,COMPLETE
6,6,1.4660165309906006,1,6,512,0.00010148574536523249,resnet18,8,4,8,19,COMPLETE
7,7,5.1084513664245605,0,5,512,0.02873829670448537,densenet121,4,3,10,28,COMPLETE
8,8,1.6776005029678345,0,6,224,0.00019287621650416727,resnet18,3,3,4,27,COMPLETE
9,9,5.1084513664245605,0,7,512,0.038525409067471705,densenet121,4,8,10,20,COMPLETE
10,10,1.6669621467590332,2,10,512,6.823287513533805e-05,resnet18,8,5,7,15,COMPLETE
11,11,1.6066784858703613,2,10,512,0.0001154609998438909,resnet18,8,5,7,15,COMPLETE
12,12,1.6196808815002441,2,10,512,0.001095558179346345,resnet18,6,5,6,16,COMPLETE
13,13,1.722517728805542,1,9,512,2.4830038364090314e-05,resnet18,10,6,8,21,COMPLETE
14,14,1.6344562768936157,2,6,512,0.0017279045404113378,resnet34,8,10,5,17,COMPLETE
15,15,1.7757092714309692,1,9,512,0.0002727561870821772,resnet50,6,5,8,23,COMPLETE
16,16,1.9027777910232544,3,7,512,4.718738158352028e-05,resnet18,8,4,5,15,COMPLETE
17,17,1.9884752035140991,-1,8,512,0.0012530866662273205,resnet18,9,7,8,21,COMPLETE
18,18,7.156914710998535,1,6,512,1.4378036390736102e-05,resnet18,7,2,6,18,COMPLETE
19,19,1.64982271194458,2,10,512,0.0001390074239650665,resnet34,9,4,7,17,COMPLETE
20,20,1.7674349546432495,3,5,512,0.0005688368156347535,resnet50,5,7,4,24,COMPLETE
21,21,1.8017139434814453,2,10,512,0.0036821328996241368,resnet18,6,5,6,16,COMPLETE
22,22,1.7757092714309692,2,9,512,0.0005426044967973524,resnet18,6,5,5,15,COMPLETE
23,23,1.4920213222503662,1,10,512,0.00010450890870369306,resnet18,7,4,7,17,COMPLETE
24,24,1.926418423652649,0,10,512,7.454375539366146e-05,resnet18,8,4,9,19,COMPLETE
25,25,1.6805555820465088,1,9,512,2.7611096742672067e-05,resnet18,7,3,7,17,COMPLETE
26,26,1.9021867513656616,1,8,224,6.403811283603814e-06,resnet18,2,6,9,21,COMPLETE
27,27,1.5056146383285522,0,10,512,0.00045150225158998653,resnet18,9,4,8,19,COMPLETE
28,28,1.756205677986145,0,7,512,0.00042013495375094846,resnet50,9,4,8,19,COMPLETE
29,29,1.981382966041565,-1,5,224,0.008978180927679356,resnet34,10,6,9,22,COMPLETE
30,30,1.85017728805542,0,9,512,0.005168224960646848,resnet18,9,2,8,20,COMPLETE
31,31,1.5268912315368652,1,10,512,0.00010999528099648198,resnet18,8,4,7,18,COMPLETE
32,32,1.5966311693191528,1,10,512,0.0002560222072138939,resnet18,7,3,7,18,COMPLETE
33,33,1.9411938190460205,0,10,512,3.898993390839419e-05,resnet18,8,4,7,20,COMPLETE
34,34,1.5765366554260254,1,8,512,9.473244680373118e-05,resnet18,7,4,8,19,COMPLETE
35,35,5.109633445739746,1,9,224,0.09943326052947474,resnet34,9,3,6,17,COMPLETE
36,36,5.44946813583374,4,10,512,3.878068338766007e-06,resnet18,9,2,9,18,COMPLETE
37,37,13.447104454040527,0,9,512,1.0413130020233307e-06,densenet121,10,6,7,22,COMPLETE
38,38,13.42464542388916,-1,6,224,1.5644292851709338e-05,resnet50,5,3,2,16,COMPLETE
39,39,1.6421394348144531,1,7,512,0.0008352893197835108,resnet18,7,4,6,26,COMPLETE
40,40,1.802304983139038,0,8,224,0.002212405647692389,densenet121,8,3,8,19,COMPLETE
41,41,1.5895390510559082,1,8,512,0.00010456487358959365,resnet18,7,4,8,20,COMPLETE
42,42,1.4671986103057861,1,10,512,0.0002263174263395587,resnet18,7,4,8,18,COMPLETE
43,43,1.5008865594863892,1,10,512,0.0002012371975871742,resnet18,8,5,9,18,COMPLETE
44,44,1.5475767850875854,0,10,512,0.0001965151121181558,resnet18,6,6,10,16,COMPLETE
45,45,1.6929669380187988,2,10,512,0.0003884817822296489,resnet18,5,5,9,17,COMPLETE
46,46,1.566489338874817,1,9,512,0.0001723484371158036,resnet18,7,5,9,30,COMPLETE
47,47,1.489066243171692,0,10,512,4.377795467692534e-05,densenet121,8,5,10,19,COMPLETE
48,48,1.502659559249878,1,10,512,3.0315845581808986e-05,densenet121,8,5,10,18,COMPLETE
49,49,1.4571512937545776,2,9,512,6.168397470474747e-05,densenet121,7,5,10,21,COMPLETE
50,50,1.740248203277588,3,9,512,4.4894941117129906e-05,densenet121,7,10,10,23,COMPLETE
51,51,1.509751796722412,2,10,512,6.119286562366104e-05,densenet121,8,5,10,21,COMPLETE
52,52,1.5257092714309692,2,10,512,1.6637103890787303e-05,densenet121,8,5,9,20,COMPLETE
53,53,1.8052600622177124,1,9,512,9.244205898438918e-06,densenet121,6,8,10,19,COMPLETE
54,54,1.4731087684631348,2,10,512,0.0002546446678204416,densenet121,7,5,9,18,COMPLETE
55,55,1.5676714181900024,3,10,512,0.0001416566906455131,densenet121,7,6,10,20,COMPLETE
56,56,1.553486943244934,2,9,512,6.67730754044912e-05,densenet121,6,7,9,16,COMPLETE
57,57,1.7053782939910889,2,6,512,0.0007511694406140265,densenet121,7,5,10,21,COMPLETE
58,58,1.6870567798614502,3,10,512,2.3946587414631443e-05,densenet121,7,3,9,17,COMPLETE
59,59,1.655141830444336,2,9,224,0.0002690053214802356,densenet121,6,4,8,22,COMPLETE
60,60,1.467789649963379,2,5,512,4.99944809897985e-05,densenet121,8,4,10,25,COMPLETE
61,61,1.4648345708847046,2,5,512,5.088952701203245e-05,densenet121,8,4,10,26,COMPLETE
62,62,1.522754192352295,2,5,512,5.769914648353134e-05,densenet121,8,5,10,26,COMPLETE
63,63,1.476063847541809,2,5,512,3.591308066530456e-05,densenet121,8,4,10,25,COMPLETE
64,64,1.6102246046066284,2,5,512,2.1973384189208876e-05,densenet121,8,4,10,25,COMPLETE
65,65,1.8365839719772339,3,5,512,9.042188885907623e-06,densenet121,9,4,10,28,COMPLETE
66,66,1.6811466217041016,2,5,512,3.933177476657968e-05,densenet121,7,3,9,24,COMPLETE
67,67,1.5741726160049438,3,6,512,8.54928238418162e-05,densenet121,8,4,10,28,COMPLETE
68,68,1.6504137516021729,2,5,512,0.00031713330173464794,resnet34,9,3,9,25,COMPLETE
69,69,1.4997044801712036,2,5,512,3.224693090331913e-05,resnet50,7,4,10,29,COMPLETE
70,70,1.4949764013290405,2,6,512,7.918979519376412e-05,densenet121,8,4,9,26,COMPLETE
71,71,1.5351654291152954,2,5,512,0.0001302549923798609,densenet121,8,5,10,24,COMPLETE
72,72,1.548758864402771,2,5,512,5.167846942183369e-05,densenet121,8,5,10,25,COMPLETE
73,73,1.8377659320831299,3,6,512,1.9171844012259686e-05,densenet121,9,6,10,23,COMPLETE
74,74,1.7851654291152954,2,5,512,1.2314982567932529e-05,densenet121,7,5,9,27,COMPLETE
75,75,1.4807919263839722,2,6,512,0.00016580809368564007,densenet121,8,3,9,26,COMPLETE
76,76,1.6468676328659058,2,6,224,0.00017544567703947837,densenet121,6,2,9,26,COMPLETE
77,77,1.5257092714309692,2,7,512,0.0002537113708566183,resnet34,9,3,8,25,COMPLETE
78,78,2.2231087684631348,1,5,512,0.0005729680367355139,resnet50,3,3,9,27,COMPLETE
79,79,1.5635342597961426,3,6,512,0.00012620173991584582,densenet121,7,4,4,26,COMPLETE
80,80,1.498522400856018,2,7,512,7.727269496018859e-05,densenet121,8,3,8,24,COMPLETE
81,81,1.8903664350509644,-1,5,512,3.5074805277135525e-05,densenet121,8,4,10,27,COMPLETE
82,82,1.4843380451202393,2,6,512,6.102573742739564e-05,densenet121,8,4,10,19,COMPLETE
83,83,1.4736998081207275,2,6,512,0.00015400138628326356,densenet121,9,4,10,25,COMPLETE
84,84,1.5830378532409668,2,6,512,0.0003467035290005659,densenet121,9,2,10,25,COMPLETE
85,85,1.4926122426986694,1,7,512,0.00020293635445560752,densenet121,10,3,9,23,COMPLETE
86,86,1.5375295877456665,2,5,512,9.920606114861155e-05,densenet121,10,4,9,26,COMPLETE
87,87,1.5954492092132568,1,6,224,0.00015008357298767238,densenet121,9,4,10,24,COMPLETE
88,88,1.620271921157837,2,6,512,0.0002162555735846412,resnet34,7,4,10,28,COMPLETE
89,89,1.8602246046066284,2,8,512,0.0006040453897231248,resnet50,8,3,9,25,COMPLETE
90,90,1.4671986103057861,1,5,512,0.0001090182412222358,densenet121,9,5,8,18,COMPLETE
91,91,1.5422576665878296,1,5,512,4.866592198418884e-05,densenet121,9,5,8,18,COMPLETE
92,92,1.5393025875091553,1,5,512,0.00011013267136723091,densenet121,9,5,8,18,COMPLETE
93,93,1.4713356494903564,1,5,512,0.00016028768877670316,densenet121,10,6,8,17,COMPLETE
94,94,1.4482860565185547,1,5,512,0.0004109528853346837,densenet121,10,7,7,17,COMPLETE
95,95,1.6533688306808472,1,5,512,0.0015035397084119293,densenet121,10,7,7,17,COMPLETE
96,96,1.5215721130371094,1,5,512,0.0004260315824155188,densenet121,10,7,7,17,COMPLETE
97,97,1.5475767850875854,1,5,512,0.0003163109774841383,resnet18,10,6,8,16,COMPLETE
98,98,1.6220449209213257,1,5,512,0.0009242274178500842,densenet121,10,8,7,15,COMPLETE
99,99,1.7183805704116821,1,5,512,0.00023840013866505898,densenet121,10,6,3,18,COMPLETE
