,number,value,params_freeze,params_gamma,params_imgSize,params_lr,params_modelname,params_nd1,params_nd2,params_nd3,params_step_size,state
0,0,2.3118624687194824,4,5,224,0.006875116310288597,densenet121,9,6,7,24,COMPLETE
1,1,5.123971939086914,4,8,224,3.3327071948198673e-06,resnet34,7,9,2,27,COMPLETE
2,2,2.573352813720703,1,8,512,0.020092579670291193,resnet50,7,4,2,27,COMPLETE
3,3,1.9954454898834229,3,7,512,9.195711093584041e-06,densenet121,4,2,10,19,COMPLETE
4,4,11.626213073730469,3,6,224,1.7298960752692157e-06,resnet18,4,3,10,18,COMPLETE
5,5,2.372154951095581,-1,9,224,0.025968112020783182,densenet121,10,7,9,30,COMPLETE
6,6,1.9149569272994995,1,6,512,0.00010148574536523249,resnet18,8,4,8,19,COMPLETE
7,7,5.108849048614502,0,5,512,0.02873829670448537,densenet121,4,3,10,28,COMPLETE
8,8,1.643343210220337,0,6,224,0.00019287621650416727,resnet18,3,3,4,27,COMPLETE
9,9,5.10988712310791,0,7,512,0.038525409067471705,densenet121,4,8,10,20,COMPLETE
10,10,2.0015695095062256,-1,10,224,0.0007387831329754048,resnet18,2,5,4,23,COMPLETE
11,11,1.8731650114059448,1,6,512,4.5257346146329804e-05,resnet18,8,5,6,16,COMPLETE
12,12,1.7794122695922852,2,6,224,6.24875493001676e-05,resnet18,2,5,5,16,COMPLETE
13,13,1.7179076671600342,2,6,224,0.0013376093390069601,resnet18,2,2,4,15,COMPLETE
14,14,1.6347928047180176,2,5,224,0.001184285778133567,resnet34,2,2,4,25,COMPLETE
15,15,1.8453643321990967,0,5,224,0.002811694047421397,resnet34,5,2,4,25,COMPLETE
16,16,1.7307279109954834,2,5,224,0.00035516703680471513,resnet34,3,10,3,22,COMPLETE
17,17,1.6725592613220215,3,7,224,0.00012381532048169602,resnet50,6,3,6,30,COMPLETE
18,18,1.8593921661376953,0,5,224,1.750910785004066e-05,resnet34,3,4,5,25,COMPLETE
19,19,1.9197826385498047,-1,7,224,0.003494143382260272,resnet34,3,6,3,28,COMPLETE
20,20,1.6385539770126343,1,6,224,0.0003518220011978629,resnet50,5,3,5,22,COMPLETE
21,21,1.6818078756332397,1,6,224,0.000340761156298883,resnet50,5,3,5,22,COMPLETE
22,22,1.6305822134017944,2,5,224,0.0007372136585298888,resnet50,5,2,3,26,COMPLETE
23,23,1.7797058820724487,2,5,224,0.0010650177930874281,resnet50,6,2,3,25,COMPLETE
24,24,1.667374849319458,3,5,224,0.004760998535950627,resnet50,5,2,6,21,COMPLETE
25,25,1.6725845336914062,2,5,224,0.0006086701469336164,resnet50,7,4,3,24,COMPLETE
26,26,5.1104607582092285,1,6,224,0.09928432712305817,resnet50,5,2,7,23,COMPLETE
27,27,1.6370086669921875,2,5,224,0.0015536410187851459,resnet50,6,3,2,26,COMPLETE
28,28,1.7927961349487305,3,10,224,0.008523921072439185,resnet34,6,4,2,26,COMPLETE
29,29,1.6015584468841553,2,5,224,0.002242854278491908,resnet50,9,7,2,29,COMPLETE
30,30,2.416557550430298,4,9,224,0.009741859775622976,resnet50,10,9,3,29,COMPLETE
31,31,1.5803121328353882,2,5,224,0.001471433907943933,resnet50,9,7,2,26,COMPLETE
32,32,1.7091078758239746,2,5,224,0.002217176672056668,resnet50,9,7,2,28,COMPLETE
33,33,1.7021461725234985,3,5,224,0.006112507900258499,resnet50,9,7,2,26,COMPLETE
34,34,2.9246468544006348,4,5,224,0.000780548682080523,resnet34,8,8,3,24,COMPLETE
35,35,1.960723638534546,2,8,512,0.0024617117631284906,resnet50,10,6,2,27,COMPLETE
36,36,1.6450241804122925,3,5,224,0.012856029598908573,resnet50,7,8,2,29,COMPLETE
37,37,1.6202369928359985,1,6,224,0.0005983277724584716,resnet34,9,7,4,29,COMPLETE
38,38,1.4470175504684448,1,6,512,0.00017230791632891337,densenet121,9,7,3,29,COMPLETE
39,39,1.5934690237045288,1,7,512,2.2817247627678073e-05,densenet121,9,7,2,29,COMPLETE
40,40,1.9992671012878418,1,7,512,4.144991617178791e-06,densenet121,8,9,2,30,COMPLETE
41,41,1.6764764785766602,1,7,512,2.969866846243957e-05,densenet121,9,7,2,29,COMPLETE
42,42,1.3925293684005737,1,6,512,0.0001863353316899234,densenet121,9,7,3,29,COMPLETE
43,43,1.4942655563354492,0,7,512,0.0001657897486369718,densenet121,10,6,3,28,COMPLETE
44,44,1.4839930534362793,0,8,512,0.0001521587375812233,densenet121,10,6,3,28,COMPLETE
45,45,1.5241869688034058,0,8,512,0.0001799740293271207,densenet121,10,6,3,28,COMPLETE
46,46,1.4988960027694702,0,8,512,0.00017884356624885405,densenet121,10,6,4,27,COMPLETE
47,47,1.7904353141784668,-1,8,512,7.763039586790355e-05,densenet121,10,5,4,27,COMPLETE
48,48,1.5534634590148926,0,9,512,0.00016458287328891685,densenet121,10,6,4,30,COMPLETE
49,49,1.553776502609253,0,9,512,4.658249213544659e-05,densenet121,10,8,7,28,COMPLETE
50,50,1.878574252128601,-1,8,512,1.011619169725626e-05,densenet121,8,5,5,27,COMPLETE
51,51,1.4371658563613892,0,8,512,0.00020448182623124836,densenet121,10,6,3,28,COMPLETE
52,52,1.6077935695648193,0,8,512,8.463942227317318e-05,densenet121,10,6,3,28,COMPLETE
53,53,1.7087733745574951,0,8,512,0.0002468858928751397,densenet121,10,6,4,30,COMPLETE
54,54,1.5117751359939575,0,7,512,0.00012914576274673865,densenet121,9,6,3,28,COMPLETE
55,55,1.4807122945785522,0,9,512,0.00023314651835745456,densenet121,10,5,4,27,COMPLETE
56,56,1.8322235345840454,-1,10,512,5.4694399346387666e-05,densenet121,10,5,8,30,COMPLETE
57,57,1.61603581905365,0,9,512,0.0004989017452784963,densenet121,9,5,3,28,COMPLETE
58,58,1.6553398370742798,1,9,512,0.00027968083006215414,densenet121,8,8,4,27,COMPLETE
59,59,1.7368143796920776,-1,6,512,9.862445079942124e-05,densenet121,10,5,3,18,COMPLETE
60,60,1.552955150604248,0,7,512,3.5308488710521516e-05,densenet121,9,6,5,29,COMPLETE
61,61,1.564841866493225,0,8,512,0.00019190862319592148,densenet121,10,6,4,28,COMPLETE
62,62,1.5445420742034912,0,8,512,0.0004155011822685878,densenet121,10,5,3,27,COMPLETE
63,63,1.5623835325241089,0,9,512,0.0001344070189809346,densenet121,10,6,4,27,COMPLETE
64,64,1.5401180982589722,0,8,512,0.0002573116937742276,resnet18,9,6,3,25,COMPLETE
65,65,1.5392100811004639,1,7,512,7.09888458137638e-05,densenet121,10,7,5,29,COMPLETE
66,66,1.8011223077774048,-1,6,512,0.00021672044292589165,densenet121,9,7,3,30,COMPLETE
67,67,1.5002050399780273,1,7,512,0.00011601723222712585,densenet121,10,5,4,26,COMPLETE
68,68,1.6224652528762817,0,8,512,0.000433544022734966,densenet121,9,4,3,28,COMPLETE
69,69,1.6836110353469849,1,6,512,0.0008026135971969298,densenet121,10,6,4,27,COMPLETE
70,70,1.6915756464004517,0,10,512,0.0003177821957008704,resnet18,8,8,3,29,COMPLETE
71,71,1.5518845319747925,1,7,512,0.00013615342633875032,densenet121,10,5,4,26,COMPLETE
72,72,1.557775616645813,1,7,512,9.373747893881177e-05,densenet121,10,4,4,27,COMPLETE
73,73,1.5995728969573975,1,8,512,5.7858324448561876e-05,densenet121,10,5,5,26,COMPLETE
74,74,1.4944387674331665,0,7,512,0.00010976733965566611,densenet121,9,7,4,28,COMPLETE
75,75,11.204585075378418,0,6,512,1.1002035283425286e-06,densenet121,9,7,3,28,COMPLETE
76,76,1.552456021308899,0,7,512,3.952086026015906e-05,densenet121,7,7,4,29,COMPLETE
77,77,1.8421218395233154,-1,8,512,0.00017196515091741805,densenet121,9,6,6,28,COMPLETE
78,78,1.7952601909637451,0,9,512,0.0009728005208782691,densenet121,9,7,3,30,COMPLETE
79,79,1.563034176826477,0,7,512,1.7775836413125167e-05,densenet121,8,6,3,29,COMPLETE
80,80,1.6910676956176758,0,6,512,0.0005012254650928301,resnet18,9,8,2,28,COMPLETE
81,81,1.5638368129730225,1,7,512,0.00012590886208093603,densenet121,10,5,4,26,COMPLETE
82,82,1.5358716249465942,1,7,512,0.0002211360439262607,densenet121,10,7,5,27,COMPLETE
83,83,1.4965513944625854,1,8,512,0.00010051208798047546,densenet121,10,6,4,27,COMPLETE
84,84,1.5981918573379517,0,8,512,7.720093737589975e-05,densenet121,10,6,5,29,COMPLETE
85,85,1.5189894437789917,0,8,512,0.00031751098446414997,densenet121,10,7,3,28,COMPLETE
86,86,1.425538420677185,1,8,512,0.0001605286460256687,densenet121,9,6,4,25,COMPLETE
87,87,1.6237634420394897,1,8,512,6.35172595658282e-05,densenet121,8,6,4,25,COMPLETE
88,88,1.5215493440628052,1,9,512,0.00014474416137781496,resnet34,9,7,9,29,COMPLETE
89,89,1.5762356519699097,1,9,512,0.00010251326227029699,densenet121,9,6,2,23,COMPLETE
90,90,1.6341620683670044,1,8,512,4.9329173076442116e-05,densenet121,9,7,3,25,COMPLETE
91,91,1.5897736549377441,0,8,512,0.00021834848996156786,densenet121,10,6,4,27,COMPLETE
92,92,1.5645674467086792,0,8,512,0.0001615096839292039,densenet121,10,6,4,24,COMPLETE
93,93,1.4925569295883179,1,8,512,0.0003592999870699709,densenet121,9,6,4,27,COMPLETE
94,94,1.5432586669921875,1,8,512,0.0003536648844108182,densenet121,9,7,3,28,COMPLETE
95,95,1.6182303428649902,1,8,512,0.0005765147798418384,densenet121,8,6,4,27,COMPLETE
96,96,1.5889774560928345,1,6,512,0.00029051348894869637,densenet121,9,10,3,26,COMPLETE
97,97,1.7462542057037354,2,7,512,2.861070663287736e-05,densenet121,9,6,5,28,COMPLETE
98,98,1.6406333446502686,1,8,512,0.00041926375111930365,densenet121,8,5,3,27,COMPLETE
99,99,1.6268393993377686,1,6,512,9.916210323612726e-05,densenet121,4,7,4,29,COMPLETE
